{
  "$schema": "https://json-schema.org/draft/2020-12/schema",
  "$id": "https://rideidle.local/schema/part.schema.json",
  "title": "Part definition (one file in parts/)",
  "type": "object",
  "properties": {
    "slug": { "$ref": "common.schema.json#/$defs/slug" },
    "name": { "$ref": "common.schema.json#/$defs/i18n" },
    "slot": {
      "enum": ["tires", "suspension", "brakes", "engine", "boost", "gearbox", "exhaust", "cooling", "tank", "ecu"]
    },
    "tire_kind": {
      "description": "Which column of the tire matrix of the rules the tires use: how well they grip on each surface. Only tires have it, and every tire has it.",
      "enum": ["all_season", "street", "slick", "rain", "offroad", "winter"]
    },
    "tier": { "$ref": "common.schema.json#/$defs/tier" },
    "price_cents": { "$ref": "common.schema.json#/$defs/cents" },
    "stats": {
      "description": "Base statistics of the model. Rarity and upgrades multiply them at run time.",
      "type": "object",
      "minProperties": 1,
      "propertyNames": { "pattern": "^[a-z][a-z0-9_]*$" },
      "additionalProperties": { "type": "number" }
    },
    "engine": {
      "description": "Only the parts of the slot engine have it, and every one of them: the layout and the displacement of the model. The power and the mass of the engine are in stats (power_kw and engine_mass_kg) and follow from the rules of the engines, which a test checks; the car takes its power and its engine mass from the part instead of from its own definition.",
      "type": "object",
      "properties": {
        "layout": { "type": "string", "pattern": "^[RV][0-9]{1,2}$" },
        "displacement_l": { "type": "number", "exclusiveMinimum": 0 }
      },
      "required": ["layout", "displacement_l"],
      "additionalProperties": false
    },
    "requires": {
      "description": "What the car must have for the part to be put on it: an engine of at least min_cylinders cylinders (the number in the layout of its engine, R4 is 4 and V8 is 8), and, for the parts that only work with a booster (an intercooler), a booster on the car. A job that puts the part on a car that does not meet it is refused.",
      "type": "object",
      "properties": {
        "min_cylinders": { "type": "integer", "minimum": 1, "maximum": 12 },
        "booster": { "const": true }
      },
      "minProperties": 1,
      "additionalProperties": false
    },
    "fits": {
      "description": "Optional restriction to vehicle classes or powertrains.",
      "type": "object",
      "properties": {
        "powertrain": { "enum": ["ice", "ev"] },
        "classes": {
          "type": "array",
          "items": {
            "enum": ["hatchback", "hot_hatch", "sedan", "coupe", "muscle", "pickup", "van", "gt", "super", "hyper"]
          },
          "minItems": 1,
          "uniqueItems": true
        }
      },
      "additionalProperties": false
    }
  },
  "required": ["slug", "name", "slot", "tier", "price_cents", "stats"],
  "additionalProperties": false,
  "allOf": [
    {
      "if": { "properties": { "slot": { "const": "tires" } }, "required": ["slot"] },
      "then": { "required": ["tire_kind"] },
      "else": { "not": { "required": ["tire_kind"] } }
    },
    {
      "if": { "properties": { "slot": { "const": "engine" } }, "required": ["slot"] },
      "then": { "required": ["engine"] },
      "else": { "not": { "required": ["engine"] } }
    }
  ]
}
