{
  "slug": "engine-v10-5-7-t9",
  "name": {
    "en": "V10 5.7 engine",
    "pl": "Silnik V10 5.7",
    "fr": "Moteur V10 5.7",
    "de": "Motor V10 5.7",
    "pt-BR": "Motor V10 5.7"
  },
  "slot": "engine",
  "tier": 9,
  "price_cents": 11319246,
  "stats": { "power_kw": 638.4, "engine_mass_kg": 391.5 },
  "engine": { "layout": "V10", "displacement_l": 5.7 }
}
