{
  "slug": "sport-suspension-t1",
  "name": {
    "en": "Sport suspension",
    "pl": "Zawieszenie sportowe",
    "fr": "Suspension sport",
    "de": "Sportfahrwerk",
    "pt-BR": "Suspensão esportiva"
  },
  "slot": "suspension",
  "tier": 1,
  "price_cents": 75000,
  "stats": { "handling": 100, "ride_height_mm": 25 }
}
