{
  "slug": "biturbo-pro-t9",
  "name": {
    "en": "Twin-turbo Pro",
    "pl": "Bi-turbo Pro",
    "fr": "Bi-turbo Pro",
    "de": "Biturbo Pro",
    "pt-BR": "Biturbo Pro"
  },
  "slot": "boost",
  "tier": 9,
  "price_cents": 9500000,
  "stats": { "power_mult": 1.55, "lag": 3, "fuel_mult": 1.34, "engine_load": 18 },
  "requires": { "min_cylinders": 8 }
}
